{
  "specVersion": "1.0",
  "id": "focus",
  "template": "template.html",
  "kind": "prose",
  "accepts": {
    "blockTypes": [
      "paragraph"
    ]
  },
  "slots": [
    {
      "name": "content",
      "source": "content",
      "required": true
    }
  ],
  "fallbackVariant": "source",
  "baseStyles": {
    "r0": {
      "margin": "44px 0 28px",
      "padding-left": "24px",
      "padding-right": "24px",
      "color": "#242830",
      "font-family": "Iowan Old Style, STSong, Songti SC, Georgia, serif",
      "font-size": "13px",
      "font-weight": "300",
      "line-height": "2.25",
      "letter-spacing": ".8px",
      "text-align": "justify"
    }
  },
  "variants": [
    {
      "id": "source",
      "label": "TUO focus",
      "priority": 60,
      "visualWeight": "medium",
      "surface": "open",
      "emphasisCost": 1,
      "styles": {}
    }
  ]
}
