{
  "specVersion": "1.0",
  "id": "masthead",
  "template": "template.html",
  "kind": "masthead",
  "accepts": {
    "blockTypes": [
      "article-title"
    ]
  },
  "slots": [
    {
      "name": "content",
      "source": "content",
      "required": true
    }
  ],
  "fallbackVariant": "source",
  "baseStyles": {
    "r0": {
      "margin": "0",
      "color": "#1a1c1a",
      "font-family": "Noto Serif SC, Songti SC, STSong, Georgia, serif",
      "font-size": "29px",
      "font-weight": "400",
      "line-height": "1.4",
      "letter-spacing": "0.08em"
    },
    "r1": {
      "display": "block",
      "width": "48px",
      "margin": "28px 0 0",
      "border-top": "1px solid #948777"
    },
    "r2": {
      "display": "block",
      "margin": "28px 0 64px",
      "color": "#7a7a78",
      "font-family": "Iowan Old Style, STSong, Songti SC, Georgia, serif",
      "font-size": "10px",
      "font-weight": "400",
      "letter-spacing": "0.25em"
    },
    "r3": {
      "margin": "64px 0 64px"
    },
    "r4": {
      "aspect-ratio": "16 / 10",
      "overflow": "hidden",
      "border-radius": "0px"
    },
    "r5": {
      "display": "block",
      "width": "100%",
      "height": "100%",
      "object-fit": "cover",
      "border-radius": "0px"
    },
    "r6": {
      "margin-top": "6px",
      "color": "#7a7a78",
      "font-family": "Iowan Old Style, STSong, Songti SC, Georgia, serif",
      "font-size": "10px",
      "letter-spacing": ".16em",
      "text-align": "center",
      "font-style": "italic"
    }
  },
  "variants": [
    {
      "id": "source",
      "label": "TUO masthead",
      "priority": 60,
      "visualWeight": "strong",
      "surface": "open",
      "emphasisCost": 1,
      "styles": {}
    }
  ]
}
