{
  "specVersion": "1.0",
  "id": "image",
  "template": "template.html",
  "kind": "image",
  "accepts": {
    "blockTypes": [
      "image"
    ]
  },
  "slots": [
    {
      "name": "src",
      "source": "image-src",
      "required": true
    },
    {
      "name": "alt",
      "source": "image-alt",
      "required": true
    },
    {
      "name": "caption",
      "source": "image-caption",
      "required": false
    }
  ],
  "fallbackVariant": "source",
  "baseStyles": {
    "r0": {
      "margin": "30px 0 0",
      "padding": "0"
    },
    "r1": {
      "aspect-ratio": "16 / 9",
      "overflow": "hidden",
      "border-radius": "0px"
    },
    "r2": {
      "display": "block",
      "width": "100%",
      "height": "100%",
      "object-fit": "cover",
      "border-radius": "0px",
      "opacity": ".9"
    },
    "r3": {
      "display": "block",
      "margin-top": "16px",
      "color": "#66635b",
      "font-family": "Iowan Old Style, STSong, Songti SC, Georgia, serif",
      "font-size": "11px",
      "line-height": "1.7",
      "letter-spacing": ".05em",
      "text-align": "center",
      "font-style": "italic"
    }
  },
  "variants": [
    {
      "id": "source",
      "label": "TUO image",
      "priority": 60,
      "visualWeight": "medium",
      "surface": "open",
      "emphasisCost": 1,
      "styles": {}
    }
  ]
}
