{
  "specVersion": "1.0",
  "id": "heading",
  "template": "template.html",
  "kind": "heading",
  "accepts": {
    "blockTypes": [
      "heading"
    ],
    "levels": [
      2
    ]
  },
  "slots": [
    {
      "name": "content",
      "source": "content",
      "required": true
    }
  ],
  "fallbackVariant": "source",
  "baseStyles": {
    "r0": {
      "margin": "30px 0 28px",
      "color": "#262626",
      "font-family": "Noto Serif SC, Songti SC, Georgia, serif",
      "font-size": "16px",
      "font-weight": "700",
      "line-height": "1.45",
      "letter-spacing": ".02em"
    }
  },
  "variants": [
    {
      "id": "source",
      "label": "TUO heading",
      "priority": 60,
      "visualWeight": "medium",
      "surface": "open",
      "emphasisCost": 1,
      "styles": {}
    }
  ]
}
