{
  "specVersion": "1.0",
  "id": "subheading",
  "template": "template.html",
  "kind": "heading",
  "accepts": {
    "blockTypes": [
      "heading"
    ],
    "levels": [
      3
    ]
  },
  "slots": [
    {
      "name": "content",
      "source": "content",
      "required": true
    }
  ],
  "fallbackVariant": "source",
  "baseStyles": {
    "r0": {
      "display": "flex",
      "align-items": "center",
      "gap": "12px",
      "margin": "40px 0 24px",
      "padding": "0"
    },
    "r1": {
      "display": "flex",
      "align-items": "center",
      "gap": "5px",
      "color": "#B08A52",
      "font-family": "-apple-system, BlinkMacSystemFont, PingFang SC, Helvetica Neue, STHeiti, sans-serif",
      "font-size": "13.5px",
      "font-weight": "500",
      "line-height": "1",
      "letter-spacing": ".08em"
    },
    "r2": {
      "display": "inline-flex",
      "align-items": "stretch",
      "gap": "3px",
      "height": "18px"
    },
    "r3": {
      "width": "2px"
    },
    "r4": {
      "width": "1px"
    },
    "r5": {
      "display": "flex",
      "align-items": "center",
      "max-width": "calc(100% - 44px)",
      "padding": "8px 16px 8px 12px",
      "border-radius": "0"
    },
    "r6": {
      "margin": "0",
      "color": "#3A3732",
      "font-family": "-apple-system, BlinkMacSystemFont, PingFang SC, Helvetica Neue, STHeiti, sans-serif",
      "font-size": "13.5px",
      "font-weight": "600",
      "line-height": "1.4",
      "letter-spacing": ".04em"
    }
  },
  "variants": [
    {
      "id": "source",
      "label": "TUO subheading",
      "priority": 60,
      "visualWeight": "medium",
      "surface": "open",
      "emphasisCost": 1,
      "styles": {}
    }
  ]
}
