{
  "specVersion": "1.0",
  "id": "callout",
  "template": "template.html",
  "kind": "prose",
  "accepts": {
    "blockTypes": [
      "callout"
    ]
  },
  "slots": [
    {
      "name": "content",
      "source": "content",
      "required": true
    }
  ],
  "fallbackVariant": "source",
  "baseStyles": {
    "r0": {
      "margin": "36px 13px 0",
      "padding": "32px 40px",
      "border-radius": "24px",
      "color": "#333333",
      "font-family": "LXGW WenKai, LXGW WenKai Mono TC, Songti SC, Georgia, serif",
      "font-size": "14px",
      "font-weight": "400",
      "line-height": "1.8",
      "text-align": "left"
    }
  },
  "variants": [
    {
      "id": "source",
      "label": "TUO callout",
      "priority": 60,
      "visualWeight": "strong",
      "surface": "open",
      "emphasisCost": 1,
      "styles": {}
    }
  ]
}
