{
  "specVersion": "1.0",
  "id": "subheading",
  "template": "template.html",
  "kind": "heading",
  "accepts": {
    "blockTypes": [
      "heading"
    ],
    "levels": [
      3
    ]
  },
  "slots": [
    {
      "name": "content",
      "source": "content",
      "required": true
    }
  ],
  "fallbackVariant": "source",
  "baseStyles": {
    "r0": {
      "display": "flex",
      "align-items": "center",
      "gap": "16px",
      "margin": "28px 0 0",
      "padding": "0"
    },
    "r1": {
      "display": "inline-flex",
      "align-items": "center",
      "justify-content": "center",
      "width": "32px",
      "height": "32px",
      "border-radius": "50%",
      "background-color": "#11413e",
      "color": "#ffffff",
      "font-family": "Noto Serif SC, Songti SC, STSong, Georgia, serif",
      "font-size": "14.5px",
      "font-weight": "700",
      "line-height": "1"
    },
    "r2": {
      "display": "flex",
      "align-items": "center",
      "max-width": "calc(100% - 44px)",
      "min-height": "32px",
      "padding": "0 32px 0 16px",
      "border-radius": "18px 0 0 18px"
    },
    "r3": {
      "margin": "0",
      "color": "#333333",
      "font-family": "Noto Serif SC, Songti SC, STSong, Georgia, serif",
      "font-size": "14.5px",
      "font-weight": "700",
      "line-height": "1.5",
      "letter-spacing": "0.04em"
    }
  },
  "variants": [
    {
      "id": "source",
      "label": "TUO subheading",
      "priority": 60,
      "visualWeight": "medium",
      "surface": "open",
      "emphasisCost": 1,
      "styles": {}
    }
  ]
}
